Question,1,2,3,4,5,Reflective Questions,EXAMPLE
SC1,"This suggests that you may have significant physical or cognitive limitations, such as paralysis or stroke-related cognitive impairments, which prevent you from preparing food independently.","This suggests that you may face significant challenges in preparing food, such as difficulties with fine motor skills or coordination.","This suggests that you may have minor difficulties in preparing food, possibly due to mild physical limitations or difficulties with multi-tasking. ","This suggests that you may have some minor challenges in preparing food, such as fatigue or mild weakness. ",This indicates that you did not experience any difficulties in preparing food.,"During the past week, was there an instance where you were making a meal for yourself and you found it to be challenging?","f.x. you're hands were shaking, you couldn't control kitchen equipment with precision, you got too tired"
SC2,"This option suggests that you are unable to eat without assistance, and may need help cutting or swallowing your food.","This option suggests that you faced significant difficulties in eating, possibly due to physical or cognitive limitations. You may have experienced difficulties with using utensils or with swallowing.",This option suggests that you experienced minor difficulties in eating. This could indicate minor physical limitations or difficulties with using utensils.,"This option suggests that you experienced some minor challenges in eating, possibly due to fatigue or mild physical limitations.",This option indicates that you did not experience any difficulties in eating.,"During the past week, what was your experinece while eating food? Was there a part of the process that proved to be difficult? ","f.x. cutting food, chewing, swallowing"
SC4,"This suggests that you may require assistance with dressing due to significant physical or cognitive limitations, such as paralysis or stroke-related cognitive impairments.",This option suggests that you may face significant challenges in dressing yourself due to difficulties with fine motor skills or coordination. ,"This option suggests that you may experience minor difficulties in getting dressed, possibly due to mild physical limitations or difficulties with multi-tasking.","This option suggests that you may experience some minor challenges in getting dressed, such as fatigue or mild weakness. ",This option indicates that you did not experience any difficulties in getting dressed.,"During the past week, did you experience any issues while putting your clothes on?",has examples
SC5,This suggests that you may need assistance with taking a bath or shower due to severe physical or cognitive limitations.,"This suggests that you faced significant challenges in taking a bath or shower, possibly due to difficulties with balance, coordination, or mobility.","This suggests that you experienced minor difficulties in taking a bath or shower, possibly due to mild physical limitations or difficulties with multi-tasking.","This suggests that you experienced some minor challenges in taking a bath or shower, such as fatigue or mild weakness.",This indicates that you did not experience any difficulties in taking a bath or shower.,"During the past week, was there a time where you had trouble taking a bath or shower? ","f.x. you couldn't get out of the bath, you needed to sit down in the shower, you couldn't wash all parts pf your body"
SC8,"This option suggests that you were unable to use the toilet independently, and may need assistance.","This option suggests that you faced significant difficulties in using the toilet, possibly due to physical or cognitive limitations.",This option suggests that you experienced minor difficulties in using the toilet. ,"This option suggests that you experienced some minor challenges in using the toilet, possibly due to fatigue or mild weakness.",This option indicates that you did not experience any difficulties in using the toilet.,"During the past week, when going to the bathroom, did you experience any inconveniences?","f.x. you had trouble taking off clothes, you had trouble controlling your bowels or bladder"
V1,You were unable to see the television at all and could not enjoy a show.,You faced significant challenges in seeing the television.,"You experienced minor difficulties in seeing the television, possibly due to mild visual impairments or distractions in the environment.","You experienced some minor challenges in seeing the television, such as fatigue or mild visual strain.",You did not experience any difficulties in seeing the television.,"During the past week, when watching TV, was it difficult for you to see the content as clearly as you would like to?","f.x. your eyes got tired, started watering, your vision got blurry"
V2,"You may have been unable to reach for things due to poor eyesight, and required assistance with daily activities.","You may have faced significant challenges in reaching for things, possibly due to visual impairments or difficulties with visual processing.","You may have experienced minor difficulties in reaching for things, possibly due to mild visual impairments or distractions in the environment.","You may have experienced some minor challenges in reaching for things, such as fatigue or mild visual strain.",You did not experience any difficulties in reaching for things due to poor eyesight.,"During the past week, did your poor eyesight  affect your ability to reach for things?","f.x. objects had a different location than were you saw them, there is a part of your FOV that is obstructed"
V3,"This option suggests that you were unable to see things off to one side at all, and required assistance with daily activities.",This option suggests that you faced significant challenges in seeing things off to one side.,This option suggests that you experienced minor difficulties in seeing things off to one side.,"This option suggests that you experienced some minor challenges in seeing things off to one side, such as fatigue or mild visual strain.",This option indicates that you did not experience any difficulties in seeing things off to one side.,"During the past week, did you notice your vision being obstructed on one side so that you had trouble seeing objects?","f.x. when crossing a road, when biking, you were missing a part of field of vision"
L2,This indicates that you were unable to speak or required significant assistance in communicating.,This suggests that you faced significant challenges in speaking.,This option suggests that you experienced minor difficulties in speaking.,"This option suggests that you experienced some minor challenges in speaking, such as occasional stuttering or mild slurring of words.",This indicates that you did not experience any difficulties in speaking.,"During the past week, did you find yourself having trouble communicating your thoughts to others?",has examples
L3,You were unable to speak clearly enough to use the telephone and required assistance.,You faced significant challenges in speaking clearly enough to use the telephone.,You experienced minor difficulties in speaking clearly enough to use the telephone.,"You experienced some minor challenges in speaking clearly enough to use the telephone, such as occasional difficulty with pronunciation.",You did not experience any difficulties in speaking clearly enough to use the telephone.,"During the past week, were you able to talk on the phone with others understanding you clearly?",f.x. you had to have somone else take over a conversation as people couldn't understand you
L5,"You were unable to communicate effectively with other people, and they required assistance in understanding you.",Other people faced significant challenges in understanding what you were saying.,Other people experienced minor difficulties in understanding what you were saying.,"Other people experienced some minor challenges in understanding what you were saying, such as occasional difficulty with pronunciation or expression.",Other people did not experience any difficulties in understanding what you were saying.,"During the past week, did you had trouble expressing yourself to others so that they understood you?","f.x. they kept asking you to repeat your words, seemed confused, or said you were making no sense"
L6,You may have difficulty finding the words you want to say and may require assistance in communicating.,You may face significant challenges in finding the words you want to say.,You may experience minor difficulties in finding the words you want to say.,"You may experience some minor challenges in finding the words you want to say, such as occasional word-finding difficulties.",You may not experience any difficulties in finding the words you want to say.,"During the past week, was there an instance where you couldnt think of the right words to say?",f.x. you knew there was a specific word you wanted to say but you couldnt put it into speech
L7,This option suggests that you were unable to repeat yourself and required assistance in communicating effectively.,This option suggests that you faced significant challenges in repeating yourself.,This option suggests that you experienced minor difficulties in repeating yourself.,"This option suggests that you experienced some minor challenges in repeating yourself, such as occasional difficulty with enunciation or expression.",This option indicates that you did not experience any difficulties in repeating yourself.,"During the past week, have you had to repeat your words because other people had trouble understanding you talk?",f.x. people asked you to repeat a certain word or a whole sentence  
M1,"Based on your response, it suggests that you were unable to walk at all and required significant assistance with mobility.",Your response suggests that you faced significant challenges in walking.,"Your response indicates that you experienced minor difficulties in walking, such as occasional unsteadiness or fatigue.","Your response suggests that you experienced some minor challenges in walking, such as slight difficulty with balance or coordination.",Your response indicates that you did not experience any difficulties in walking.,"During the past week, when moving around outside or inside, did you have any difficulty?","f.x. you have trouble walking up stairs, you need extra equipment/help when walking outside "
M4,This suggests that you were unable to bend over or reach for objects without losing your balance and required assistance or modifications to perform these activities safely.,This suggests that you faced significant challenges in maintaining your balance when bending over or reaching for objects.,This suggests that you experienced minor difficulties in maintaining your balance when bending over or reaching for objects.,"This suggests that you experienced some minor challenges in maintaining your balance when bending over or reaching for objects, such as slight difficulty with coordination or balance.",This suggests that you did not experience any difficulties in maintaining your balance when bending over or reaching for objects.,"During the past week, was there a time where you bent or reached over to pick something up and (almost) lost you balance?",f.x. when using a chair to reach a higher shelf you did not feel comfortable 
M6,This suggests that you were unable to climb stairs and needed assistance or modifications to access areas that require stairs.,This suggests that you faced significant challenges in climbing stairs.,"This suggests that you experienced minor difficulties in climbing stairs, such as occasional unsteadiness or fatigue.","This suggests that you experienced some minor challenges in climbing stairs, such as slight difficulty with coordination or balance.",This indicates that you did not experience any difficulties in climbing stairs.,"During the past week, did you experience difficulty walking up stairs?","f.x. you had to take a long pause while walking up stairs, or someone had to help you"
M7,This option suggests that you were unable to walk or use a wheelchair without needing to stop and rest frequently.,"This option suggests that you faced significant challenges with fatigue or endurance when walking or using a wheelchair, and needed frequent breaks or rest periods.",This option suggests that you experienced minor difficulties with fatigue or endurance when walking or using a wheelchair.,This option suggests that you experienced some minor challenges with fatigue or endurance when walking or using a wheelchair.,This option indicates that you did not experience any difficulties with fatigue or endurance when walking or using a wheelchair.,"During the past week, did you require a break while moving from one location to another?","f.x. you had to take breaks while going for a walk, had to shorten an activity that required movement"
M8,"This suggests that you were unable to stand without assistance or support, and had difficulty maintaining balance even with assistance.","This suggests that you could stand for short periods of time with support, but had difficulty maintaining balance on your own.","This suggests that you could stand for short periods of time without support, but had difficulty maintaining balance.","This suggests that you were able to stand for longer periods of time without support, but experienced some discomfort or instability.",This suggests that you were able to stand comfortably and maintain balance without difficulty.,"During the past week, did standing up cause you any uncomfortableness or problems?","f.x. when preparing a meal, in the shower, getting dressed, cleaning"
M9,This option suggests that you were unable to get out of a chair without assistance or support.,This option suggests that you could get out of a chair with some difficulty or discomfort.,"This option suggests that you could get out of a chair, but with some difficulty or discomfort.","This option suggests that you could get out of a chair without difficulty, but with some discomfort or stiffness.",This option indicates that you were able to get out of a chair comfortably and without difficulty.,"During the past week, did you get stuck or had to give a lot of energy to get up from sitting down? ","f.x. when getting up from the sofa, you take a long time to get up, sometimes you abandon attempts and sit for longer to recover strength"
W1,"This option suggests that you were unable to perform any daily work around the house, such as cleaning, cooking, or doing laundry.",This option suggests that you had significant difficulty performing daily work around the house and required assistance to complete tasks.,"This option suggests that you could perform daily work around the house, but with some difficulty or discomfort.",This option suggests that you could perform daily work around the house with minor difficulty or discomfort.,This option indicates that you were able to perform daily work around the house comfortably and without difficulty.,"During the past week, was it difficult to keep up with all your household chores?","f.x. dusting, washing dishes, cooking, gardening, washing laundry"
W2,"This option suggests that you were unable to complete any job that you started, and required significant assistance or support to finish tasks.","This option suggests that you faced significant difficulty in finishing jobs that you started, and required assistance to complete tasks.","This option suggests that you were able to finish jobs that you started, but with some difficulty or delays.","This option suggests that you were able to finish jobs that you started, but with minor difficulty or delays.",This option indicates that you were able to comfortably finish jobs that you started without any difficulty.,"During the past week, have there been times where you started a project but couldnt find the energy/motivation to finish it?","f.x. you get too tired or its taking too long and you give up, you have to take mulltiple breaks to finish an activity  "
W3,This suggests that you require significant assistance or support to complete tasks.,This option suggests that you require assistance to complete tasks.,This option suggests that you had some difficulty or limitations due to your condition.,This option suggests that you are able to do most of the work with minor difficulty or limitations.,This option indicates that you are able to do the work that you used to do comfortably and without difficulty.,"During the past week, did you experience trouble performing the activties that you were previously able to do?","f.x. after coming back home, you struggle to read as you used to, you cant take care of your garden anymore"
UE1,This suggests that your condition prevented you from being able to write or type at all.,This suggests that you had significant difficulty writing or typing.,"This suggests that you could write or type, but with some difficulty or limitations.",This suggests that you could write or type with minor difficulty or limitations.,This suggests that you were able to write or type comfortably and without difficulty.,"During the past week, was there a time where you had to write/type something and that was very difficult for you?","f.x. during crossword puzzles, writing you signature, on your phone"
UE2,This suggests that you were unable to put on socks.,This suggests that you had significant difficulty putting on socks.,"This suggests that you could put on socks, but with some difficulty or limitations.",This suggests that you could put on socks with minor difficulty or limitations.,This suggests that you were able to put on socks comfortably and without difficulty.,"During the past week, did you struggle to put on your socks? ","f.x. took you a long time, required help form someone else"
UE3,"Based on your response, it seems that you were unable to button at all.",Your response indicates that you had significant difficulty buttoning buttons.,"It appears that you could button buttons, but with some difficulty or limitations.","According to your response, you were able to button buttons with minor difficulty or limitations.",Your response suggests that you were able to button buttons comfortably and without difficulty.,"During the past week, did you struggle to button buttons?","f.x. took you a long time, required help form someone else"
UE5,"Based on your response, it appears that you were unable to zip a zipper at all.","Based on your response, it appears that you had significant difficulty zipping a zipper.","Based on your response, it appears that you were able to zip a zipper, but with some difficulty or limitations.","Based on your response, it appears that you were able to zip a zipper with minor difficulty or limitations.","Based on your response, it appears that you were able to zip a zipper comfortably and without difficulty.","During the past week, did you struggle to zip a zipper?","f.x. took you a long time, required help form someone else"
UE6,This suggests that opening a jar is extremely challenging for you.,Your response indicates that opening a jar is quite difficult for you.,"Your response suggests that you are able to open a jar, but with some difficulty or limitations.",Your response indicates that you can open a jar with minor difficulty or limitations.,Your response suggests that you are able to open a jar comfortably and without difficulty.,"During the past week, did you struggle to open a jar?","fx. you lacked the strength, couldn't grip it properly"
T2,Your response suggests that you experienced significant difficulty in concentrating.,"Your response suggests that you experienced some difficulty in concentrating, but it did not significantly affect your daily life",Your response suggests that you did not experience any significant difficulty in concentrating.,Your response suggests that you experienced some ease in concentrating and did not have any significant issues with concentration.,Your response suggests that you did not experience any difficulty in concentrating.,"During the past week, did you experience trouble paying attention or focusing?","f.x. when at the doctors, you had trouble keeping up with what was being said"
T3,"You frequently forgot things, even important events or appointments.",You sometimes forgot things and it did impact your daily life.,"You sometimes forgot things, but it did not significantly impact your daily life.",You did experience minor memory problems.,You did not experience any noticeable memory problems. ,"During the past week, have you been forgetting things because you have a hard time remembering them? ","f.x. you forgot your friend vistied you the week before, you dont remeber if you took your medicine that day"
T4,You had significant difficulty in remembering things and had to write everything down to avoid forgetting important events or appointments.,"You had to write down some things to remember them, but not everything.",You didn't need to write things down more than you did before your stroke.,"While you sometimes wrote things down to remember them, it wasn't necessary for most things.",You didn't need to write anything down to remember them.,"During the past week, was there an instance where you had to write something down because you knew you would probably forget it?","f.x. documents to take to the doctors appointement, when are friends coming to visit"
P1,you had frequent emotional outbursts and couldn't control your feelings.,You had more difficulty controlling your emotions,"You had some trouble controlling my emotions after the stroke, but it wasn't a major issue.",Your emotional control was about the same as it was before the stroke.,You had no trouble controlling your emotions after the stroke.,"During the past week, was there a time where you did not care abouth anyone or anything happening around you?","f.x. I felt too tired to try to engage with my friends, i didnt find any activty interesting/pleasurable enough"
P2,This suggests that you experienced significant impatience with others.,This suggests that you experienced some impatience with others.,This suggests that you didn't experience much impatience with others.,This suggests that you didn't experience much impatience with others.,This suggests that you did not experience any impatience with others.,"During the past week, would you consider yourself sometimes easily annoyed or angry without good reason? ","f.x. small things would easily make me mad, I didn't want to talk with anyone"
P3,You experienced significant changes in your personality.,You experienced some changes in your personality.,You did experience a little change in your personality.,You did not experience much change in your personality.,You did not experience any change in your personality after your stroke.,"During the past week, did you feel like you lacked patience when it came to other peoples troubles?","f.x. without any reason, I was very intolerant towards others mistakes, my reactions weren't appropriate to the situation"
MD2,you felt like your future was bleak and couldn't imagine a positive outcome.,Sometimes you feel discouraged about your future.,you had moments of doubt about my future.,You had some worries about the future.,you never felt discouraged about your future.,"During the past week, did you feel like you weren't being yourself?","f.x. I feel like I'm not myself anymore, my friends say I behave differently"
MD3,You lost interest in spending time with people and doing things you enjoy,You had less interest in socializing and activities,My interest in other people and activities was about the same.,You were still interested in spending time with people and doing things you enjoyed.,you were just as interested in other people and activities.,"During the past week, did you feel like you had nothing to look forward to in the future? ",f.x. I didn't want to set any goals for myself or try to work on my recovery
FR5,You avoided fun activities with your family and didn't feel like participating in them.,"You participated in some activities, but there were many that you avoided",You participated in fun activities with your family,"You participated in most activities with your family, but there were some that you had to skip",You participated in all fun activities with your family.,"During the past week, have you missed out on fun family activties because you didnt feel like joining?",f.x. I didnt join because I was scared I would ruin everyones fun with my disabilities
FR7,This suggests that you often felt like burden to your family.,This suggests that you had some moments where you felt like you were a burden to your family,This suggests that you didn't feel like your were a burden to your family.,"This suggests that while you knew your family was helping you out a lot, you didn't feel like you were a burden to them.",This suggests that you never felt like you were a burden to your family.,"During the past week, were you afraid you were inconveniencing, annoying, or frustrating you family? Or that you ask too much of them?","f.x. I didn't want to tell my family about how I felt physically/mentally to not burden them further, I felt like I needed to be as least trouble as possible beacuse I already need so much from my family"
