Question,1,2,3,4,5,Reflective Questions,EXAMPLE
FR8,Your response suggests that your physical condition has significantly impacted your family life.,Your response suggests that your physical condition has impacted your family life to some extent.,Your response suggests that your physical condition has not significantly impacted your family life.,Your response suggests that your physical condition has only a minor impact on your family life.,Your response suggests that your physical condition has no impact on your family life.,"During the past week, have you been held back by your physical health when hanging out with your family? ",f.x. I could not go on any more family trips as I cannot walk without a walker 
SR1,This suggests that your physical or emotional limitations resulting from the stroke are significantly impacting your ability to go out.,This suggests that you are somewhat limited in going out.,This suggests that your ability to go out is not significantly impacted by physical or emotional limitations.,This suggests that you are only slightly limited in going out.,This suggests that you had no limitations in going out.,"During the past week, did you spend more time at home than you would have preferred?",f.x. I was scared to go out to see my freinds as I'm afraid of falling when commuting
SR4,This suggests that your ability to participate in hobbies and recreational activities is significantly limited due to physical or emotional limitations.,"Based on your response, it appears that you are somewhat limited in your ability to participate in hobbies and recreational activities.",This suggests that your ability to participate in hobbies and recreational activities is not significantly impacted by physical or emotional limitations.,"Based on your response, it appears that you are only slightly limited in your ability to participate in hobbies and recreational activities.",This suggests that your ability to participate in hobbies and recreational activities is not limited at all.,"During the past week, do you think you spent enough time performing your hobbies and favourite activties? ","f.x. I lost interest in fishing, I dont garden as much as I used to because I get so easily fatigued"
SR5,Your physical limitations or difficulties in transportation prevented you from seeing your friends.,"You were able to see your friends, but not as often as you would like because of fatigue, anxiety, or other symptoms.",You were able to see your friends sometimes.,You were able to see your friends nearly as often as you wanted.,You were able to see your friends as often as you wanted.,"During the past week, did you visit or spend time with as many of your friends as you would have liked?",f.x. I lost contact with some of my friends due to not being able to do the actvities we once shared
SR6,Your physical limitations or other issues made it difficult for you to engage in sexual activity.,"You were able to have sex, but not as often as you would like because of fatigue, anxiety, or other symptoms.",You did not have a desire to have sex or it was not a priority for you.,"You were able to have sex as often as you wanted, but preferred to engage in other activities instead.","You were able to have sex as often as you wanted, and you did not experience any limitations or difficulties in doing so.","During the past week, have you participated in sexual activities less than you would have preferred?",f.x. I was unable to have sexual relations with my partner and had to turn them down several times
SR7,This suggests that your physical limitations have made it challenging for you to engage in social activities or interact with others.,"you were able to participate in social activities, but not as frequently as you would have preferred due to symptoms like fatigue and anxiety.",You did not feel that your physical condition interfered with your social life.,"It seems that you were able to participate in social activities as often as you wanted, but you preferred to spend time alone.",Your response indicates that you did not experience any limitations or difficulties in engaging in social activities due to your physical condition.,"During the past week, was there a time where your physical health prevented you from seeing or intercating with others?","f.x. I felt like my speech impairement made me unable to make new friends, my worsened mobility prevented me from taking the bus and visiting my friends"
MD6,"Based on your response, it suggests that you have been withdrawing yourself from family and friends.","Based on your response, it suggests that you have started to avoid social events or initiate contact with people.","Based on your response, it suggests that you have mixed feelings about socializing. Some days, you may feel withdrawn, while other days you want to interact with others.","Based on your response, it suggests that you have managed to maintain your social connections and participate in social events.","Based on your response, it suggests that your health condition after the stroke did not affect your social interactions with others, and you were able to maintain your normal social life.","During the past week, did you feel like you were distancing yourself from the people around you?","f.x. I felt like an outsider, like noone could understand what I was going through and I didnt want to explain myself"
MD7,This suggests that your symtoms had a significant impact on your self-esteem and confidence.,This suggests that you may have experienced a decrease in confidence.,Your responses indicate that you had mixed feelings about your self-confidence.,"This suggests that although the stroke affected your abilities, you were able to regain your confidence in yourself and your ability to perform daily activities.",This suggests that your confidence in yourself and your abilities was not affected by your health condition.,"During the past week, have you had problems with underestimating yourself or not believing in yout own abilities?",f.x. Having to accept assiatnce from others in many situations made me feel useless and stupid
MD8,This suggests that you experienced a loss of appetite.,"Based on your response, it seems that food didn't taste as good as it used to, and you had less interest in eating.","Your response indicates that your appetite was inconsisten, and some days you were less interested in food than others.",Your response suggests that you were still interested in food and maintained a healthy diet after the stroke.,This suggests that your appetite was not affected and you maintained your normal eating habits.,"During the past week, have you experinced a loss of apetite or a aversion towards food?","f.x. I didn't enjoy eating meals, oftentimes I wasn't hungry for any food  "
E2,This suggests that you experienced a high level of fatigue and exhaustion.,"Based on your response, it seems that you felt somewhat fatigued and lacked energy.",Your response suggests that you did not feel more or less tired than usual.,Your response suggests that you felt relatively alert and energetic most of the time.,This suggests that you felt energetic and vibrant most of the time.,"During the past week, have you felt like you had little to no energy in your everyday life?",f.x. I had to take several naps to be able to get through the day.
E3,This suggests that you needed to rest frequently during the day due to exhaustion or other physical limitations.,"Based on your response, it seems that you needed to take several breaks during the day to rest.",Your response indicates that you did not need to stop and rest any more frequently than usual.,This suggests that you did not need to rest very often during the day.,Your response indicates that you did not need to rest at all during the day.,"During the past week, have you required multiple rests and pauses from your activities during the day?","f.x. During the day I had to pause vacuuming and take several break, sometimes, I wasnt able to continue until the next day"
E4,Your response suggests that you experienced significant exhaustion and fatigue.,Your response suggests that you experienced some fatigue that affected your ability to engage in the activities you wanted to do.,Your response suggests that you were able to do most of the things you wanted to do without feeling too tired.,Your response suggests that you were rarely too tired to do the things you wanted to do.,Your response suggests that you were never too tired to do the things you wanted to do.,"During the past week, did you find it difficult to accomplish the tasks/activities you had set for yourself?",f.x. I had planned to mow my lawn but I had to stop after a couple minutes and leave it for another day